Ensembl	Gene	"Gene synonym"	"Gene description"	Uniprot	Chromosome	Position	"Protein class"	"Biological process"	"Molecular function"	"Disease involvement"
ENSG00000163762	TM4SF18	L6D	"Transmembrane 4 L six family member 18"	Q96CE8	3	149318498-149334414	"Predicted membrane proteins, Transporters"			
ENSG00000131634	TMEM204	"C16orf30, CLP24, FLJ20898"	"Transmembrane protein 204"	Q9BSN7	16	1528688-1555580	"Predicted membrane proteins"	"Stress response"		
ENSG00000184497	TMEM255B	"FAM70B, MGC20579"	"Transmembrane protein 255B"	Q8WV15	13	113759240-113816995	"Predicted membrane proteins, Transporters"			
ENSG00000167874	TMEM88	"FLJ20025, MGC71744"	"Transmembrane protein 88"	Q6PEY1	17	7855065-7856099	"Predicted membrane proteins"	"Wnt signaling pathway"	"Developmental protein"	
ENSG00000133687	TMTC1	"ARG99, FLJ31400, FLJ41625, OLF"	"Transmembrane and tetratricopeptide repeat containing 1"	Q8IUR5	12	29500840-29784759	"Predicted membrane proteins"		Transferase	
ENSG00000173530	TNFRSF10D	"CD264, DcR2, TRAILR4, TRUNDD"	"TNF receptor superfamily member 10d"	Q9UBN6	8	23135588-23164030	"Cancer-related genes, CD markers, Predicted membrane proteins"	Apoptosis	Receptor	"Cancer-related genes"
ENSG00000186827	TNFRSF4	"ACT35, CD134, OX40, TXGP1L"	"TNF receptor superfamily member 4"	P43489	1	1211326-1214138	"Cancer-related genes, CD markers, Disease related genes, Predicted membrane proteins"	"Host-virus interaction"	"Host cell receptor for virus entry, Receptor"	"Cancer-related genes, Disease mutation"
ENSG00000168477	TNXB	"TNXB1, TNXB2, TNXBS, XB, XBS"	"Tenascin XB"	P22105	6	32041154-32115334	"Disease related genes, Plasma proteins, Predicted intracellular proteins, Predicted secreted proteins"	"Cell adhesion"		"Disease mutation, Ehlers-Danlos syndrome"
ENSG00000115705	TPO	TPX	"Thyroid peroxidase"	P07202	2	1374223-1543711	"Disease related genes, Enzymes, FDA approved drug targets, Predicted intracellular proteins, Predicted membrane proteins"	"Hydrogen peroxide, Thyroid hormones biosynthesis"	"Oxidoreductase, Peroxidase"	"Congenital hypothyroidism, Disease mutation, FDA approved drug targets"
ENSG00000157570	TSPAN18	TSPAN	"Tetraspanin 18"	Q96SJ8	11	44726465-44932421	"Predicted membrane proteins"			
ENSG00000156298	TSPAN7	"A15, CD231, DXS1692E, MRX58, MXS1, TALLA-1, TM4SF2"	"Tetraspanin 7"	P41732	X	38561370-38688920	"CD markers, Disease related genes, Potential drug targets, Predicted membrane proteins, Transporters"	"Host-virus interaction"		"Disease mutation, Mental retardation"
ENSG00000130307	USHBP1	"AIEBP, FLJ38709, MCC2"	"USH1 protein network component harmonin binding protein 1"	Q8N6Y0	19	17249176-17282786	"Predicted intracellular proteins"			
ENSG00000168899	VAMP5		"Vesicle associated membrane protein 5"	O95183	2	85584408-85593412	"Predicted membrane proteins"	"Differentiation, Myogenesis"	"Developmental protein"	
ENSG00000150630	VEGFC	VRP	"Vascular endothelial growth factor C"	P49767	4	176683538-176792727	"Cancer-related genes, Disease related genes, Potential drug targets, Predicted secreted proteins, RAS pathway related proteins, Transporters"	"Angiogenesis, Differentiation"	"Developmental protein, Growth factor, Mitogen"	"Cancer-related genes"
ENSG00000110799	VWF	F8VWF	"Von Willebrand factor"	P04275	12	5948874-6124770	"Cancer-related genes, Candidate cardiovascular disease genes, Disease related genes, FDA approved drug targets, Plasma proteins, Predicted secreted proteins"	"Blood coagulation, Cell adhesion, Hemostasis"		"Cancer-related genes, Disease mutation, FDA approved drug targets, von Willebrand disease"
ENSG00000018408	WWTR1	"DKFZp586I1419, TAZ"	"WW domain containing transcription regulator 1"	Q9GZV5	3	149517235-149736714	"Cancer-related genes, Predicted intracellular proteins"	"Transcription, Transcription regulation"	Activator	"Cancer-related genes, Proto-oncogene"
ENSG00000148516	ZEB1	"AREB6, BZP, FECD6, NIL-2-A, PPCD3, TCF8, ZEB, Zfhep, Zfhx1a"	"Zinc finger E-box binding homeobox 1"	P37275	10	31318495-31529814	"Disease related genes, Predicted intracellular proteins, Transcription factors"	"Differentiation, Neurogenesis, Transcription, Transcription regulation"	"Activator, DNA-binding, Repressor"	"Corneal dystrophy, Disease mutation"
ENSG00000178175	ZNF366	FLJ39796	"Zinc finger protein 366"	Q8N895	5	72442652-72507727	"Predicted intracellular proteins, Transcription factors"	"Transcription, Transcription regulation"	"DNA-binding, Repressor"	
ENSG00000198795	ZNF521	"EHZF, Evi3"	"Zinc finger protein 521"	Q96K83	18	25061926-25352190	"Cancer-related genes, Disease related genes, Predicted intracellular proteins, Transcription factors"	"Differentiation, Transcription, Transcription regulation"	"Activator, Developmental protein, DNA-binding, Repressor"	"Cancer-related genes, Proto-oncogene"
ENSG00000180884	ZNF792	FLJ38451	"Zinc finger protein 792"	Q3KQV3	19	34956354-34964049	"Predicted intracellular proteins, Transcription factors"	"Transcription, Transcription regulation"	DNA-binding	
