Ensembl	Gene	"Gene synonym"	"Gene description"	Uniprot	Chromosome	Position	"Protein class"	"Biological process"	"Molecular function"	"Disease involvement"
ENSG00000148841	ITPRIP	"bA127L20.2, DANGER, KIAA1754"	"Inositol 1,4,5-trisphosphate receptor interacting protein"	Q8IWB1	10	104309698-104338404	"Predicted membrane proteins"			
ENSG00000184916	JAG2		"Jagged 2"	Q9Y219	14	105140981-105168824	"Predicted membrane proteins"	"Notch signaling pathway"	"Developmental protein"	
ENSG00000154721	JAM2	"C21orf43, CD322, JAM-B, JAMB, VE-JAM"	"Junctional adhesion molecule 2"	P57087	21	25639272-25717562	"CD markers, Predicted membrane proteins"			
ENSG00000186994	KANK3	"ANKRD47, FLJ46061"	"KN motif and ankyrin repeat domains 3"	Q6NY19	19	8322584-8343262	"Predicted intracellular proteins"			
ENSG00000143603	KCNN3	"hSK3, KCa2.3, SKCA3"	"Potassium calcium-activated channel subfamily N member 3"	Q9UGI6	1	154697455-154870280	"FDA approved drug targets, Predicted membrane proteins, Voltage-gated ion channels"	"Ion transport, Transport"	"Calmodulin-binding, Ion channel"	"Disease mutation, FDA approved drug targets"
ENSG00000128052	KDR	"CD309, FLK1, VEGFR, VEGFR2"	"Kinase insert domain receptor"	P35968	4	55078259-55125595	"Cancer-related genes, CD markers, Disease related genes, Enzymes, FDA approved drug targets, Plasma proteins, Predicted membrane proteins, RAS pathway related proteins"	"Angiogenesis, Differentiation, Host-virus interaction"	"Developmental protein, Kinase, Receptor, Transferase, Tyrosine-protein kinase"	"Cancer-related genes, FDA approved drug targets"
ENSG00000127528	KLF2	LKLF	"Kruppel like factor 2"	Q9Y5W3	19	16324817-16327874	"Predicted intracellular proteins, Transcription factors"	"Transcription, Transcription regulation"	"Activator, DNA-binding"	
ENSG00000102271	KLHL4	"DKELCHL, KHL4, KIAA1687"	"Kelch like family member 4"	Q9C0H6	X	87517749-87670050	"Predicted intracellular proteins"		Actin-binding	
ENSG00000204381	LAYN	"FLJ30977, FLJ31092"	Layilin	Q6UX15	11	111540280-111561745	"Predicted intracellular proteins, Predicted membrane proteins"			
ENSG00000267206	LCN6		"Lipocalin 6"	P62502	9	136744011-136748528	"Predicted intracellular proteins, Predicted secreted proteins"	Fertilization		
ENSG00000169744	LDB2	"CLIM1, LDB1"	"LIM domain binding 2"	O43679	4	16501541-16898809	"Predicted intracellular proteins"			
ENSG00000116678	LEPR	"CD295, OBR"	"Leptin receptor"	P48357	1	65420652-65641559	"Cancer-related genes, Candidate cardiovascular disease genes, CD markers, Disease related genes, FDA approved drug targets, Plasma proteins, Predicted membrane proteins, Predicted secreted proteins"		Receptor	"Cancer-related genes, FDA approved drug targets, Obesity"
ENSG00000072163	LIMS2	"PINCH-2, PINCH2"	"LIM zinc finger domain containing 2"	Q7Z4I7	2	127638381-127681786	"Disease related genes, Predicted intracellular proteins"			"Disease mutation, Limb-girdle muscular dystrophy"
ENSG00000135363	LMO2	"RBTN2, RBTNL1, RHOM2, TTG2"	"LIM domain only 2"	P25791	11	33858576-33892289	"Cancer-related genes, Disease related genes, Predicted intracellular proteins"			"Cancer-related genes, Proto-oncogene"
ENSG00000134013	LOXL2	"LOR, WS9-14"	"Lysyl oxidase like 2"	Q9Y4K0	8	23297189-23425328	"Enzymes, Predicted intracellular proteins, Predicted secreted proteins"	"Transcription, Transcription regulation"	"Chromatin regulator, Oxidoreductase, Repressor"	
ENSG00000137507	LRRC32	"D11S833E, GARP"	"Leucine rich repeat containing 32"	Q14392	11	76657524-76670747	"Predicted intracellular proteins, Predicted membrane proteins"		"Growth factor binding"	
ENSG00000186105	LRRC70	"LOC100130733, SLRN"	"Leucine rich repeat containing 70"	Q7Z2Q7	5	62578735-62581448	"Predicted intracellular proteins, Predicted membrane proteins"			
ENSG00000171488	LRRC8C	AD158	"Leucine rich repeat containing 8 VRAC subunit C"	Q8TDW0	1	89633072-89769903	"Predicted membrane proteins, Transporters"	"Ion transport, Transport"	"Ion channel"	
ENSG00000185386	MAPK11	"p38-2, p38Beta, PRKM11, SAPK2"	"Mitogen-activated protein kinase 11"	Q15759	22	50263713-50270767	"Enzymes, FDA approved drug targets, Predicted intracellular proteins"	"Stress response, Transcription, Transcription regulation"	"Kinase, Serine/threonine-protein kinase, Transferase"	"FDA approved drug targets"
ENSG00000076706	MCAM	"CD146, MUC18"	"Melanoma cell adhesion molecule"	P43121	11	119308529-119321521	"CD markers, Plasma proteins, Predicted membrane proteins"	"Cell adhesion"		
ENSG00000175471	MCTP1	FLJ22344	"Multiple C2 and transmembrane domain containing 1"	Q6DN14	5	94703741-95284575	"Predicted intracellular proteins, Predicted membrane proteins"			
ENSG00000005102	MEOX1	MOX1	"Mesenchyme homeobox 1"	P50221	17	43640388-43661954	"Disease related genes, Predicted intracellular proteins, Transcription factors"	"Transcription, Transcription regulation"	"Activator, Developmental protein, DNA-binding, Repressor"	
ENSG00000100060	MFNG		"MFNG O-fucosylpeptide 3-beta-N-acetylglucosaminyltransferase"	O00587	22	37469063-37486401	"Enzymes, Plasma proteins, Predicted intracellular proteins"		"Developmental protein, Glycosyltransferase, Transferase"	
ENSG00000186260	MKL2	"FLJ31823, MRTF-B"	"MKL1/myocardin like 2"	Q9ULH7	16	14071321-14266773	"Disease related genes, Predicted intracellular proteins"	"Differentiation, Myogenesis, Transcription, Transcription regulation"	"Activator, Developmental protein"	
ENSG00000138722	MMRN1	"ECM, EMILIN4, GPIa*, MMRN"	"Multimerin 1"	Q13201	4	89879532-89954629	"Disease related genes, Plasma proteins, Predicted intracellular proteins, Predicted secreted proteins"			
ENSG00000173269	MMRN2	"EMILIN3, EndoGlyx-1, FLJ13465"	"Multimerin 2"	Q9H8L6	10	86935540-86969481	"Plasma proteins, Predicted intracellular proteins, Predicted secreted proteins"	Angiogenesis		
ENSG00000163132	MSX1	"HOX7, HYD1, OFC5"	"Msh homeobox 1"	P28360	4	4859666-4863936	"Disease related genes, Predicted intracellular proteins, Transcription factors"	"Transcription, Transcription regulation"	"Developmental protein, DNA-binding, Repressor"	"Disease mutation, Ectodermal dysplasia"
ENSG00000129422	MTUS1	"ATBP, ATIP1, ATIP3, DKFZp586D1519, FLJ14295, ICIS, KIAA1288, MP44, MTSG1"	"Microtubule associated scaffold protein 1"	Q9ULD2	8	17643795-17800917	"Disease related genes, Predicted intracellular proteins, Predicted membrane proteins"			"Disease mutation, Tumor suppressor"
ENSG00000157601	MX1	"IFI-78K, MxA"	"MX dynamin like GTPase 1"	P20591	21	41420304-41459214	"Predicted intracellular proteins"	"Antiviral defense, Immunity, Innate immunity"		
ENSG00000120279	MYCT1	"FLJ21269, MTLC"	"MYC target 1"	Q8N699	6	152697895-152724567	"Predicted intracellular proteins, Predicted membrane proteins"			
ENSG00000132688	NES	FLJ21841	Nestin	P48681	1	156668763-156677397	"Plasma proteins, Predicted intracellular proteins"	Neurogenesis	"Developmental protein"	
ENSG00000214357	NEURL1B	"DKFZP761M1511, Neur2, RNF67B"	"Neuralized E3 ubiquitin protein ligase 1B"	A8MQ27	5	172641266-172691540	"Enzymes, Predicted intracellular proteins"	"Notch signaling pathway, Ubl conjugation pathway"	Transferase	
ENSG00000164867	NOS3	"ECNOS, eNOS"	"Nitric oxide synthase 3"	P29474	7	150990995-151014588	"Cancer-related genes, Disease related genes, Enzymes, FDA approved drug targets, Plasma proteins, Predicted intracellular proteins"		"Calmodulin-binding, Oxidoreductase"	"Cancer-related genes, FDA approved drug targets"
ENSG00000163072	NOSTRIN	MGC20702	"Nitric oxide synthase trafficking"	Q8IVI9	2	168786539-168865514	"Predicted intracellular proteins"	Endocytosis		
ENSG00000148400	NOTCH1	TAN1	"Notch 1"	P46531	9	136494433-136545786	"Cancer-related genes, Disease related genes, Plasma proteins, Potential drug targets, Predicted membrane proteins, Transporters"	"Angiogenesis, Differentiation, Notch signaling pathway, Transcription, Transcription regulation"	"Activator, Developmental protein, Receptor"	"Cancer-related genes, Disease mutation"
ENSG00000204301	NOTCH4	INT3	"Notch 4"	Q99466	6	32194843-32224067	"Predicted membrane proteins"	"Differentiation, Notch signaling pathway, Transcription, Transcription regulation"	"Activator, Developmental protein, Receptor"	
ENSG00000104967	NOVA2	"ANOVA, NOVA3"	"NOVA alternative splicing regulator 2"	Q9UNW9	19	45933734-45973546	"Predicted intracellular proteins"		RNA-binding	
ENSG00000124785	NRN1	NRN	"Neuritin 1"	Q9NPD7	6	5997999-6007605	"Predicted membrane proteins"			
ENSG00000074590	NUAK1	"ARK5, KIAA0537, NuaK1"	"NUAK family kinase 1"	O60285	12	106063340-106140033	"Enzymes, Plasma proteins, Predicted intracellular proteins"	"Cell adhesion, DNA damage"	"Kinase, Serine/threonine-protein kinase, Transferase"	
ENSG00000111335	OAS2		"2'-5'-oligoadenylate synthetase 2"	P29728	12	112978395-113011723	"Enzymes, Plasma proteins, Predicted intracellular proteins"	"Antiviral defense, Immunity, Innate immunity"	"Nucleotidyltransferase, RNA-binding, Transferase"	
ENSG00000185585	OLFML2A	FLJ00237	"Olfactomedin like 2A"	Q68BL7	9	124777158-124814885	"Predicted intracellular proteins, Predicted secreted proteins"			
ENSG00000254535	PABPC4L		"Poly(A) binding protein cytoplasmic 4 like"	P0CB38	4	134196333-134201748	"Predicted intracellular proteins"		RNA-binding	
ENSG00000107719	PALD1	"KIAA1274, PALD"	"Phosphatase domain containing, paladin 1"	Q9ULE6	10	70478821-70568449	"Predicted membrane proteins"			
ENSG00000099260	PALMD	"C1orf11, FLJ20271, PALML"	Palmdelphin	Q9NP74	1	99645943-99694541	"Predicted intracellular proteins"			
ENSG00000113555	PCDH12	VE-cadherin-2	"Protocadherin 12"	Q9NPG4	5	141943585-141969741	"Disease related genes, Plasma proteins, Predicted membrane proteins, Predicted secreted proteins"	"Cell adhesion"		"Disease mutation, Epilepsy, Mental retardation, Primary microcephaly"
ENSG00000118946	PCDH17	"PCDH68, PCH68"	"Protocadherin 17"	O14917	13	57631810-57729311	"Predicted intracellular proteins, Predicted membrane proteins"	"Cell adhesion"		
ENSG00000186642	PDE2A		"Phosphodiesterase 2A"	O00408	11	72576141-72674591	"Enzymes, FDA approved drug targets, Predicted intracellular proteins"		Hydrolase	"FDA approved drug targets"
ENSG00000171408	PDE7B		"Phosphodiesterase 7B"	Q9NP56	6	135851696-136195574	"Enzymes, FDA approved drug targets, Predicted intracellular proteins"		Hydrolase	"FDA approved drug targets"
ENSG00000100311	PDGFB	"SIS, SSV"	"Platelet derived growth factor subunit B"	P01127	22	39223359-39244751	"Cancer-related genes, Candidate cardiovascular disease genes, Disease related genes, Plasma proteins, Predicted intracellular proteins, Predicted secreted proteins, RAS pathway related proteins"		"Developmental protein, Growth factor, Mitogen"	"Cancer-related genes, Disease mutation, Proto-oncogene"
ENSG00000187800	PEAR1	"FLJ00193, JEDI, MEGF12"	"Platelet endothelial aggregation receptor 1"	Q5VY43	1	156893698-156916434	"Plasma proteins, Predicted intracellular proteins, Predicted membrane proteins"			
ENSG00000261371	PECAM1	CD31	"Platelet and endothelial cell adhesion molecule 1"		17	64319415-64413776	"Predicted intracellular proteins, Predicted membrane proteins"			
ENSG00000154330	PGM5	PGMRP	"Phosphoglucomutase 5"	Q15124	9	68328308-68531061	"Predicted intracellular proteins"	"Carbohydrate metabolism, Cell adhesion, Glucose metabolism"		
ENSG00000117461	PIK3R3	p55	"Phosphoinositide-3-kinase regulatory subunit 3"	Q92569	1	46040140-46133036	"Cancer-related genes, Predicted intracellular proteins, RAS pathway related proteins"			"Cancer-related genes"
ENSG00000160447	PKN3	"PKNbeta, UTDP4-1"	"Protein kinase N3"	Q6P5Z2	9	128702523-128720918	"Enzymes, Predicted intracellular proteins"		"Kinase, Serine/threonine-protein kinase, Transferase"	
ENSG00000182621	PLCB1	"KIAA0581, PLC-I, PLC154"	"Phospholipase C beta 1"	Q9NQ66	20	8077251-8968360	"Disease related genes, Enzymes, Plasma proteins, Potential drug targets, Predicted intracellular proteins"	"Lipid degradation, Lipid metabolism"	"Hydrolase, Transducer"	Epilepsy
ENSG00000120278	PLEKHG1	"ARHGEF41, KIAA1209"	"Pleckstrin homology and RhoGEF domain containing G1"	Q9ULL1	6	150599883-150843665	"Predicted intracellular proteins"		"Guanine-nucleotide releasing factor"	
ENSG00000114698	PLSCR4		"Phospholipid scramblase 4"	Q9NRQ2	3	146192339-146251179	"Plasma proteins, Predicted intracellular proteins, Predicted membrane proteins, Transporters"			
ENSG00000130300	PLVAP	"FELS, gp68, PV-1, PV1"	"Plasmalemma vesicle associated protein"	Q9BX97	19	17351448-17377350	"Plasma proteins, Predicted intracellular proteins, Predicted membrane proteins"			"Disease mutation"
ENSG00000128567	PODXL	"Gp200, PC, PCLP"	"Podocalyxin like"	O00592	7	131500262-131558217	"Plasma proteins, Predicted membrane proteins"	"Cell adhesion"		
ENSG00000110841	PPFIBP1	"hSGT2, hSgt2p, L2, SGT2"	"PPFIA binding protein 1"	Q86W92	12	27523431-27695564	"Cancer-related genes, Plasma proteins, Predicted intracellular proteins"			"Cancer-related genes"
ENSG00000046889	PREX2	"DEP.2, DEPDC2, FLJ12987, P-REX2, PPP1R129"	"Phosphatidylinositol-3,4,5-trisphosphate dependent Rac exchange factor 2"	Q70Z35	8	67952118-68237030	"Cancer-related genes, Plasma proteins, Predicted intracellular proteins"		"Guanine-nucleotide releasing factor"	"Cancer-related genes"
ENSG00000027075	PRKCH	"PKC-L, PKCL, PRKCL"	"Protein kinase C eta"	P24723	14	61187559-61550976	"Cancer-related genes, Disease related genes, Enzymes, Potential drug targets, Predicted intracellular proteins"	Differentiation	"Kinase, Serine/threonine-protein kinase, Transferase"	"Cancer-related genes"
ENSG00000150687	PRSS23	"SIG13, SPUVE"	"Serine protease 23"	O95084	11	86791059-86952910	"Enzymes, Plasma proteins, Predicted intracellular proteins, Predicted secreted proteins"		"Hydrolase, Protease, Serine protease"	
ENSG00000110786	PTPN5	"PTPSTEP, STEP, STEP61"	"Protein tyrosine phosphatase, non-receptor type 5"	P54829	11	18727928-18792721	"Enzymes, Plasma proteins, Predicted intracellular proteins, Predicted membrane proteins"		"Hydrolase, Protein phosphatase"	
ENSG00000127329	PTPRB	PTPB	"Protein tyrosine phosphatase, receptor type B"	P23467	12	70515866-70637440	"Cancer-related genes, Enzymes, Plasma proteins, Predicted intracellular proteins, Predicted membrane proteins"	Angiogenesis	"Hydrolase, Protein phosphatase"	"Cancer-related genes"
ENSG00000173482	PTPRM	"hR-PTPu, PTPRL1, RPTPU"	"Protein tyrosine phosphatase, receptor type M"	P28827	18	7566782-8406861	"Enzymes, Plasma proteins, Predicted intracellular proteins, Predicted membrane proteins"	"Cell adhesion"	"Hydrolase, Protein phosphatase, Receptor"	
ENSG00000130508	PXDN	"D2S448, D2S448E, KIAA0230, MG50, PRG2, PXN"	Peroxidasin	Q92626	2	1631887-1744852	"Disease related genes, Enzymes, Plasma proteins, Potential drug targets, Predicted intracellular proteins, Predicted secreted proteins"	"Hydrogen peroxide"	"Oxidoreductase, Peroxidase"	"Disease mutation"
ENSG00000131477	RAMP2		"Receptor activity modifying protein 2"	O60895	17	42758447-42763041	"FDA approved drug targets, Plasma proteins, Predicted intracellular proteins, Predicted membrane proteins"	Transport	Receptor	"FDA approved drug targets"
ENSG00000122679	RAMP3		"Receptor activity modifying protein 3"	O60896	7	45157791-45186302	"FDA approved drug targets, Predicted membrane proteins"	Transport	Receptor	"FDA approved drug targets"
ENSG00000079337	RAPGEF3	"bcm910, cAMP-GEFI, EPAC"	"Rap guanine nucleotide exchange factor 3"	O95398	12	47734367-47771040	"Predicted intracellular proteins"	Angiogenesis	"Guanine-nucleotide releasing factor"	
ENSG00000091428	RAPGEF4	"cAMP-GEFII, CGEF2"	"Rap guanine nucleotide exchange factor 4"	Q8WZA2	2	172735274-173052893	"Predicted intracellular proteins"	Exocytosis	"Guanine-nucleotide releasing factor"	
ENSG00000152689	RASGRP3	"CalDAG-GEFIII, GRP3, KIAA0846"	"RAS guanyl releasing protein 3"	Q8IV61	2	33436324-33564750	"Predicted intracellular proteins, RAS pathway related proteins"		"Guanine-nucleotide releasing factor"	
ENSG00000105538	RASIP1	"FLJ20401, RAIN"	"Ras interacting protein 1"	Q5U651	19	48720587-48740721	"Predicted intracellular proteins"	Angiogenesis		
ENSG00000198774	RASSF9	"P-CIP1, PAMCI"	"Ras association domain family member 9"	O75901	12	85800697-85836570	"Predicted intracellular proteins"			
ENSG00000162444	RBP7	CRBPIV	"Retinol binding protein 7"	Q96R05	1	9997206-10016020	"Predicted intracellular proteins"	Transport		
ENSG00000126785	RHOJ	"ARHJ, FLJ14445, RASL7B, TCL"	"Ras homolog family member J"	Q9H4E5	14	63204114-63293219	"Predicted intracellular proteins"	Angiogenesis		
ENSG00000154133	ROBO4	"ECSM4, FLJ20798, MRB"	"Roundabout guidance receptor 4"	Q8WZ75	11	124883691-124898500	"Plasma proteins, Predicted membrane proteins"	"Angiogenesis, Differentiation"	"Developmental protein, Receptor"	"Disease mutation"
ENSG00000105784	RUNDC3B	"RPIB9, RPIP9"	"RUN domain containing 3B"	Q96NL0	7	87627548-87832296	"Predicted intracellular proteins"			
ENSG00000170989	S1PR1	"CD363, D1S3362, edg-1, EDG1"	"Sphingosine-1-phosphate receptor 1"	P21453	1	101236888-101241518	"Cancer-related genes, CD markers, FDA approved drug targets, G-protein coupled receptors, Predicted membrane proteins, Transporters"	"Angiogenesis, Chemotaxis"	"G-protein coupled receptor, Receptor, Transducer"	"Cancer-related genes, FDA approved drug targets"
ENSG00000111961	SASH1	"dJ323M4.1, KIAA0790, SH3D6A"	"SAM and SH3 domain containing 1"	O94885	6	148272304-148552050	"Predicted intracellular proteins"			"Disease mutation, Hypotrichosis, Palmoplantar keratoderma, Tumor suppressor"
ENSG00000074660	SCARF1	"KIAA0149, SREC, SREC1"	"Scavenger receptor class F member 1"	Q14162	17	1633858-1645747	"Predicted intracellular proteins"	"Cell adhesion"	Receptor	
ENSG00000007908	SELE	"CD62E, ELAM, ELAM1, ESEL"	"Selectin E"	P16581	1	169722641-169764705	"Cancer-related genes, Candidate cardiovascular disease genes, CD markers, Plasma proteins, Predicted intracellular proteins, Predicted membrane proteins"	"Cell adhesion"		"Cancer-related genes"
ENSG00000174175	SELP	"CD62, CD62P, GMP140, GRMP, PADGEM, PSEL"	"Selectin P"	P16109	1	169588849-169630193	"Cancer-related genes, Candidate cardiovascular disease genes, CD markers, Disease related genes, Plasma proteins, Predicted intracellular proteins, Predicted membrane proteins"	"Cell adhesion"		"Cancer-related genes"
ENSG00000010319	SEMA3G	"FLJ00014, sem2"	"Semaphorin 3G"	Q9NS98	3	52433053-52445085	"Predicted secreted proteins"			
ENSG00000167680	SEMA6B	"SEM-SEMA-Y, SEMA-VIB, SEMAN, semaZ"	"Semaphorin 6B"	Q9H3T3	19	4542593-4559808	"Plasma proteins, Predicted membrane proteins"	"Differentiation, Neurogenesis"	"Developmental protein"	
ENSG00000095370	SH2D3C	NSP3	"SH2 domain containing 3C"	Q8N5H7	9	127738317-127778741	"Predicted intracellular proteins"			
ENSG00000169291	SHE		"Src homology 2 domain containing E"	Q5VZ18	1	154469772-154502113	"Predicted intracellular proteins, Predicted secreted proteins"			
ENSG00000158352	SHROOM4	KIAA1202	"Shroom family member 4"	Q9ULL8	X	50591647-50814302	"Disease related genes, Predicted intracellular proteins"		"Actin-binding, Developmental protein"	"Disease mutation, Mental retardation"
ENSG00000163053	SLC16A14	"FLJ30794, MCT14"	"Solute carrier family 16 member 14"	Q7RTX9	2	230034974-230068999	"Predicted intracellular proteins, Predicted membrane proteins, Transporters"	"Symport, Transport"		
ENSG00000168917	SLC35G2	"DKFZp564K2464, MGC3295, TMEM22"	"Solute carrier family 35 member G2"	Q8TBE7	3	136818647-136855892	"Predicted membrane proteins, Transporters"			
ENSG00000065054	SLC9A3R2	"E3KARP, NHERF-2, SIP-1, TKA-1"	"SLC9A3 regulator 2"	Q15599	16	2025356-2039026	"Predicted intracellular proteins, Transporters"			
ENSG00000174640	SLCO2A1	"MATR1, OATP2A1, PGT, SLC21A2"	"Solute carrier organic anion transporter family member 2A1"	Q92959	3	133932696-134052184	"Disease related genes, Potential drug targets, Predicted membrane proteins, Transporters"	Transport		"Disease mutation"
ENSG00000170365	SMAD1	"JV4-1, MADH1, MADR1"	"SMAD family member 1"	Q15797	4	145481194-145558079	"Cancer-related genes, Disease related genes, Predicted intracellular proteins, Transcription factors"	"Transcription, Transcription regulation"	DNA-binding	"Cancer-related genes"
ENSG00000184785	SMIM10	CXorf69	"Small integral membrane protein 10"	"Q96HG1, P0DMW3"	X	134990938-134992473	"Predicted membrane proteins"			
ENSG00000124216	SNAI1	"SLUGH2, SNA, SNAH, SNAIL, SNAIL1"	"Snail family transcriptional repressor 1"	O95863	20	49982999-49988886	"Predicted intracellular proteins, Transcription factors"		"Developmental protein, DNA-binding"	
ENSG00000184557	SOCS3	"CIS3, Cish3, SOCS-3, SSI-3"	"Suppressor of cytokine signaling 3"	O14543	17	78356778-78360077	"Disease related genes, Predicted intracellular proteins"	"Growth regulation, Ubl conjugation pathway"	"Signal transduction inhibitor"	
ENSG00000164736	SOX17		"SRY-box 17"	Q9H6I2	8	54457935-54460888	"Cancer-related genes, Disease related genes, Predicted intracellular proteins, Transcription factors"	"Transcription, Transcription regulation, Wnt signaling pathway"	"Activator, DNA-binding"	"Cancer-related genes, Disease mutation"
ENSG00000203883	SOX18		"SRY-box 18"	P35713	20	64047582-64049641	"Disease related genes, Predicted intracellular proteins, Transcription factors"	"Transcription, Transcription regulation"	"Activator, DNA-binding"	"Disease mutation, Hypotrichosis"
ENSG00000171056	SOX7		"SRY-box 7"	Q9BT81	8	10723768-10730512	"Predicted intracellular proteins, Transcription factors"	"Transcription, Transcription regulation"	"Activator, DNA-binding"	
ENSG00000152583	SPARCL1	MAST9	"SPARC like 1"	Q14515	4	87473335-87531061	"Cancer-related genes, Plasma proteins, Predicted intracellular proteins, Predicted secreted proteins"			"Cancer-related genes"
ENSG00000183018	SPNS2		"Sphingolipid transporter 2"	Q8IVW8	17	4498838-4539035	"Predicted membrane proteins, Transporters"	"Lipid transport, Transport"		"Deafness, Disease mutation, Non-syndromic deafness"
ENSG00000164056	SPRY1	hSPRY1	"Sprouty RTK signaling antagonist 1"	O43609	4	123396795-123403760	"Cancer-related genes, Predicted intracellular proteins, Predicted membrane proteins"		"Developmental protein"	"Cancer-related genes"
ENSG00000184005	ST6GALNAC3	SIAT7C	"ST6 N-acetylgalactosaminide alpha-2,6-sialyltransferase 3"	Q8NDV1	1	76074719-76634601	"Predicted intracellular proteins, Predicted membrane proteins"		"Glycosyltransferase, Transferase"	
ENSG00000148488	ST8SIA6	SIAT8F	"ST8 alpha-N-acetyl-neuraminide alpha-2,8-sialyltransferase 6"	P61647	10	17318383-17454330	"Predicted intracellular proteins"		"Glycosyltransferase, Transferase"	
ENSG00000130052	STARD8	"ARHGAP38, KIAA0189"	"StAR related lipid transfer domain containing 8"	Q92502	X	68647666-68725842	"Predicted intracellular proteins"		"GTPase activation"	
ENSG00000159167	STC1	STC	"Stanniocalcin 1"	P52823	8	23841915-23854807	"Predicted intracellular proteins, Predicted secreted proteins"		Hormone	
ENSG00000204176	SYT15	CHR10SYT	"Synaptotagmin 15"	Q9BQS2	10	46578217-46594173	"Predicted intracellular proteins, Predicted membrane proteins"			
ENSG00000162367	TAL1	"bHLHa17, SCL, TCL5"	"TAL bHLH transcription factor 1, erythroid differentiation factor"	P17542	1	47216290-47232220	"Cancer-related genes, Disease related genes, Predicted intracellular proteins, Transcription factors"	"Differentiation, Transcription, Transcription regulation"	"Developmental protein, DNA-binding"	"Cancer-related genes, Proto-oncogene"
ENSG00000125878	TCF15	"bHLHa40, EC2, PARAXIS"	"Transcription factor 15"	Q12870	20	603797-610398	"Predicted intracellular proteins, Transcription factors"	"Transcription, Transcription regulation"	"Developmental protein, DNA-binding"	
ENSG00000196628	TCF4	"bHLHb19, E2-2, ITF2, SEF2-1B"	"Transcription factor 4"	P15884	18	55222331-55664787	"Disease related genes, Predicted intracellular proteins, Transcription factors"	"Differentiation, Neurogenesis, Transcription, Transcription regulation"	"Activator, DNA-binding"	"Corneal dystrophy, Disease mutation, Epilepsy, Mental retardation, Primary microcephaly"
ENSG00000120156	TEK	"CD202b, TIE-2, TIE2, VMCM, VMCM1"	"TEK receptor tyrosine kinase"	Q02763	9	27109141-27230175	"Cancer-related genes, CD markers, Disease related genes, Enzymes, FDA approved drug targets, Plasma proteins, Predicted membrane proteins, Predicted secreted proteins, RAS pathway related proteins"	Angiogenesis	"Kinase, Receptor, Transferase, Tyrosine-protein kinase"	"Cancer-related genes, Disease mutation, FDA approved drug targets, Glaucoma"
ENSG00000163513	TGFBR2	"MFS2, TBR-ii, TBRII"	"Transforming growth factor beta receptor 2"	P37173	3	30606502-30694142	"Cancer-related genes, Disease related genes, Enzymes, Plasma proteins, Potential drug targets, Predicted membrane proteins"	"Apoptosis, Differentiation, Growth regulation"	"Kinase, Receptor, Serine/threonine-protein kinase, Transferase"	"Aortic aneurysm, Cancer-related genes, Craniosynostosis, Disease mutation, Hereditary nonpolyposis colorectal cancer"
ENSG00000178726	THBD	CD141	Thrombomodulin	P07204	20	23045633-23049741	"Candidate cardiovascular disease genes, CD markers, Disease related genes, Predicted membrane proteins"	"Blood coagulation, Hemostasis"	Receptor	"Disease mutation, Hemolytic uremic syndrome, Thrombophilia"
ENSG00000136114	THSD1	TMTSP	"Thrombospondin type 1 domain containing 1"	Q9NS62	13	52377167-52406494	"Predicted membrane proteins"			
ENSG00000066056	TIE1	"JTK14, TIE"	"Tyrosine kinase with immunoglobulin like and EGF like domains 1"	P35590	1	43300993-43323108	"Cancer-related genes, Enzymes, Plasma proteins, Predicted intracellular proteins, Predicted membrane proteins"	Angiogenesis	"Kinase, Receptor, Transferase, Tyrosine-protein kinase"	"Cancer-related genes"
ENSG00000038295	TLL1		"Tolloid like 1"	O43897	4	165873258-166103895	"Disease related genes, Enzymes, Plasma proteins, Potential drug targets, Predicted intracellular proteins, Predicted secreted proteins"	Differentiation	"Developmental protein, Hydrolase, Metalloprotease, Protease"	"Atrial septal defect, Disease mutation"
