Ensembl	Gene	"Gene synonym"	"Gene description"	Uniprot	Chromosome	Position	"Protein class"	"Biological process"	"Molecular function"	"Disease involvement"
ENSG00000175899	A2M	"CPAMD5, FWP007, S863-7"	Alpha-2-macroglobulin	P01023	12	9067664-9116229	"Cancer-related genes, Candidate cardiovascular disease genes, Plasma proteins, Predicted secreted proteins"		"Protease inhibitor, Serine protease inhibitor"	"Cancer-related genes"
ENSG00000213088	ACKR1	"CCBP1, CD234, DARC, Dfy, FY, GPD"	"Atypical chemokine receptor 1 (Duffy blood group)"	Q16570	1	159203307-159206500	"Blood group antigen proteins, CD markers, G-protein coupled receptors, Predicted membrane proteins"		"Blood group antigen, G-protein coupled receptor, Receptor, Transducer"	
ENSG00000144476	ACKR3	"CMKOR1, CXCR7, GPR159, RDC1"	"Atypical chemokine receptor 3"	P25106	2	236567787-236582358	"Cancer-related genes, G-protein coupled receptors, Predicted membrane proteins"	"Cell adhesion, Host-virus interaction"	"Developmental protein, G-protein coupled receptor, Receptor, Transducer"	"Cancer-related genes"
ENSG00000139567	ACVRL1	"ACVRLK1, ALK1, HHT, HHT2, ORW2"	"Activin A receptor like type 1"	P37023	12	51906908-51923361	"Disease related genes, Enzymes, Potential drug targets, Predicted intracellular proteins, Predicted membrane proteins"	Angiogenesis	"Kinase, Receptor, Serine/threonine-protein kinase, Transferase"	"Disease mutation"
ENSG00000136378	ADAMTS7	"ADAM-TS7, DKFZp434H204"	"ADAM metallopeptidase with thrombospondin type 1 motif 7"	Q9UKP4	15	78759203-78811431	"Plasma proteins, Predicted secreted proteins"		"Hydrolase, Metalloprotease, Protease"	
ENSG00000163638	ADAMTS9	KIAA1312	"ADAM metallopeptidase with thrombospondin type 1 motif 9"	Q9P2N4	3	64515654-64688000	"Cancer-related genes, Plasma proteins, Predicted intracellular proteins, Predicted secreted proteins"	"ER-Golgi transport, Protein transport, Transport"	"Hydrolase, Metalloprotease, Protease"	"Cancer-related genes"
ENSG00000129467	ADCY4	AC4	"Adenylate cyclase 4"	Q8NFM4	14	24318349-24335093	"Enzymes, Plasma proteins, Predicted intracellular proteins, Predicted membrane proteins"	"cAMP biosynthesis"	Lyase	
ENSG00000069122	ADGRF5	"DKFZp564O1923, GPR116, KIAA0758"	"Adhesion G protein-coupled receptor F5"	Q8IZF2	6	46852512-46954943	"G-protein coupled receptors, Plasma proteins, Predicted membrane proteins"		"G-protein coupled receptor, Receptor, Transducer"	
ENSG00000162618	ADGRL4	"ELTD1, ETL"	"Adhesion G protein-coupled receptor L4"	Q9HBW9	1	78889764-79006718	"G-protein coupled receptors, Plasma proteins, Predicted membrane proteins, Transporters"		"G-protein coupled receptor, Receptor, Transducer"	
ENSG00000157510	AFAP1L1	FLJ36748	"Actin filament associated protein 1 like 1"	Q8TED9	5	149271871-149341802	"Predicted intracellular proteins"			
ENSG00000091879	ANGPT2	Ang2	"Angiopoietin 2"	O15123	8	6499651-6563409	"Cancer-related genes, Plasma proteins, Predicted secreted proteins, RAS pathway related proteins"	"Angiogenesis, Differentiation"	"Developmental protein"	"Cancer-related genes"
ENSG00000134817	APLNR	"AGTRL1, APJ, APJR, FLJ90771"	"Apelin receptor"	P35414	11	57233577-57237314	"G-protein coupled receptors, Predicted membrane proteins, Transporters"	"Angiogenesis, Gastrulation, Host-virus interaction"	"Developmental protein, G-protein coupled receptor, Receptor, Transducer"	
ENSG00000128284	APOL3	"APOLIII, CG12-1"	"Apolipoprotein L3"	O95236	22	36140330-36166177	"Predicted intracellular proteins"	"Lipid transport, Transport"		
ENSG00000178878	APOLD1	"DKFZP434F0318, FLJ25138"	"Apolipoprotein L domain containing 1"	Q96LR9	12	12725917-12829975	"Predicted membrane proteins"	"Angiogenesis, Differentiation"	"Developmental protein"	
ENSG00000240583	AQP1	"CHIP28, CO"	"Aquaporin 1 (Colton blood group)"	P29972	7	30911694-30925516	"Blood group antigen proteins, Predicted membrane proteins, Transporters"	Transport	"Blood group antigen"	
ENSG00000120318	ARAP3	"CENTD3, DRAG1, FLJ21065"	"ArfGAP with RhoGAP domain, ankyrin repeat and PH domain 3"	Q8WWN8	5	141653401-141682221	"Predicted intracellular proteins"		"GTPase activation"	
ENSG00000137962	ARHGAP29	PARG1	"Rho GTPase activating protein 29"	Q52LW3	1	94148988-94275068	"Predicted intracellular proteins"		"GTPase activation"	
ENSG00000031081	ARHGAP31	CDGAP	"Rho GTPase activating protein 31"	Q2M1Z3	3	119294373-119420714	"Disease related genes, Predicted intracellular proteins"		"GTPase activation"	
ENSG00000198844	ARHGEF15	"ARGEF15, FLJ13791, KIAA0915, MGC44868, Vsm-RhoGEF"	"Rho guanine nucleotide exchange factor 15"	O94989	17	8310241-8322516	"Predicted intracellular proteins"		"GTPase activation, Guanine-nucleotide releasing factor"	
ENSG00000161940	BCL6B	"BAZF, ZBTB28, ZNF62"	"B cell CLL/lymphoma 6B"	Q8N143	17	7023020-7030290	"Predicted intracellular proteins, Transcription factors"			
ENSG00000153162	BMP6	"VGR, VGR1"	"Bone morphogenetic protein 6"	P22004	6	7726797-7881422	"Predicted secreted proteins"	"Chondrogenesis, Differentiation, Osteogenesis"	"Cytokine, Developmental protein, Growth factor"	
ENSG00000102010	BMX	"ETK, PSCTK3"	"BMX non-receptor tyrosine kinase"	P51813	X	15464246-15556529	"Enzymes, Predicted intracellular proteins"	"Apoptosis, Cell adhesion, Stress response"	"Kinase, Transferase, Tyrosine-protein kinase"	
ENSG00000240654	C1QTNF9	"AQL1, C1QTNF9A, CTRP9, MGC48915"	"C1q and TNF related 9"	P0C862	13	24307166-24322535	"Predicted secreted proteins, Transporters"		Hormone	
ENSG00000205502	C2CD4B	"FAM148B, NLF2"	"C2 calcium dependent domain containing 4B"	A6NLJ0	15	62163535-62165283	"Predicted intracellular proteins"			
ENSG00000064989	CALCRL	"CGRPR, CRLR"	"Calcitonin receptor like receptor"	Q16602	2	187343129-187448460	"G-protein coupled receptors, Plasma proteins, Predicted intracellular proteins, Predicted membrane proteins, Transporters"		"G-protein coupled receptor, Receptor, Transducer"	
ENSG00000177303	CASKIN2	"ANKS5B, FLJ21609, KIAA1139"	"CASK interacting protein 2"	Q8WXE0	17	75500261-75515583	"Predicted intracellular proteins"			
ENSG00000105974	CAV1	CAV	"Caveolin 1"	Q03135	7	116524785-116561184	"Cancer-related genes, Disease related genes, Potential drug targets, Predicted membrane proteins, Transporters"	"Host-virus interaction"		"Cancer-related genes, Congenital generalized lipodystrophy, Diabetes mellitus, Disease mutation"
ENSG00000101331	CCM2L	"C20orf160, dJ310O13.5"	"CCM2 like scaffolding protein"	Q9NUG4	20	32010450-32032180	"Plasma proteins, Predicted intracellular proteins"			
ENSG00000156535	CD109	"CPAMD7, DKFZp762L1111, FLJ38569"	"CD109 molecule"	Q6YHK3	6	73695785-73828316	"CD markers, Plasma proteins, Predicted membrane proteins"		"Protease inhibitor, Serine protease inhibitor"	
ENSG00000091972	CD200	"MOX1, MOX2, MRC, OX-2"	"CD200 molecule"	P41217	3	112332347-112362812	"CD markers, Predicted intracellular proteins, Predicted membrane proteins"			
ENSG00000174059	CD34		"CD34 molecule"	P28906	1	207880972-207911402	"CD markers, Predicted membrane proteins"	"Cell adhesion"		
ENSG00000125810	CD93	"C1qR(P), C1QR1, C1qRP, CDw93, dJ737E23.1, ECSM3, MXRA4"	"CD93 molecule"	Q9NPY3	20	23079349-23086340	"CD markers, Plasma proteins, Predicted membrane proteins"	"Cell adhesion, Host-virus interaction"	Receptor	
ENSG00000140945	CDH13	CDHH	"Cadherin 13"	P55290	16	82626803-83800640	"Plasma proteins, Predicted intracellular proteins"	"Cell adhesion"		
ENSG00000139880	CDH24	CDH11L	"Cadherin 24"	Q86UP0	14	23047062-23057538	"Predicted membrane proteins"	"Cell adhesion"		
ENSG00000179776	CDH5	"7B4, CD144"	"Cadherin 5"	P33151	16	66366622-66404786	"Cancer-related genes, CD markers, Plasma proteins, Predicted intracellular proteins, Predicted membrane proteins"	"Cell adhesion"		"Cancer-related genes"
ENSG00000184113	CLDN5	"AWAL, BEC1, CPETRL1, TMVCF"	"Claudin 5"	O00501	22	19523024-19527545	"Predicted membrane proteins, Transporters"			
ENSG00000176435	CLEC14A	C14orf27	"C-type lectin domain containing 14A"	Q86T13	14	38254103-38256369	"Predicted membrane proteins"			
ENSG00000150048	CLEC1A	"CLEC1, MGC34328"	"C-type lectin domain family 1 member A"	Q8NC01	12	10069554-10111627	"Predicted intracellular proteins, Predicted membrane proteins"			
ENSG00000155962	CLIC2	XAP121	"Chloride intracellular channel 2"	O15247	X	155276211-155334657	"Disease related genes, Potential drug targets, Predicted intracellular proteins, Transporters"	"Ion transport, Transport"	"Chloride channel, Ion channel, Voltage-gated channel"	"Disease mutation, Mental retardation"
ENSG00000154529	CNTNAP3B		"Contactin associated protein like 3B"	Q96NU0	9	41890314-42129510	"Predicted intracellular proteins, Predicted membrane proteins"	"Cell adhesion"		
ENSG00000139117	CPNE8		"Copine 8"	Q86YQ8	12	38646822-38907430	"Predicted intracellular proteins"			
ENSG00000182809	CRIP2	"CRP2, ESP1"	"Cysteine rich protein 2"	P52943	14	105472962-105480170	"Predicted intracellular proteins"			
ENSG00000147408	CSGALNACT1	"ChGn, CSGalNAcT-1, FLJ11264"	"Chondroitin sulfate N-acetylgalactosaminyltransferase 1"	Q8TDX6	8	19404161-19758029	"Enzymes, Predicted intracellular proteins"		Transferase	"Disease mutation"
ENSG00000164932	CTHRC1		"Collagen triple helix repeat containing 1"	Q96CG8	8	103371515-103382997	"Disease related genes, Predicted intracellular proteins, Predicted secreted proteins"			
ENSG00000006210	CX3CL1	"ABCD-3, C3Xkine, CXC3, CXC3C, fractalkine, neurotactin, NTN, SCYD1"	"C-X3-C motif chemokine ligand 1"	P78423	16	57372458-57385048	"Plasma proteins, Predicted membrane proteins, Predicted secreted proteins"	"Cell adhesion, Chemotaxis"	Cytokine	
ENSG00000147113	CXorf36	"DIA1R, FLJ14103"	"Chromosome X open reading frame 36"	Q9H7Y0	X	45148374-45200901	"Disease related genes, Predicted secreted proteins"			"Autism, Autism spectrum disorder"
ENSG00000170891	CYTL1	"C17, C4orf4"	"Cytokine like 1"	Q9NRR1	4	5014586-5019472	"Plasma proteins, Predicted secreted proteins"			
ENSG00000166265	CYYR1	C21orf95	"Cysteine and tyrosine rich 1"	Q96J86	21	26466209-26573284	"Predicted membrane proteins"			
ENSG00000166341	DCHS1	"CDH25, CDHR6, FIB1, FLJ11790, KIAA1773, PCDH16"	"Dachsous cadherin-related 1"	Q96JQ0	11	6621323-6655854	"Disease related genes, Plasma proteins, Predicted membrane proteins"	"Cell adhesion"		"Deafness, Disease mutation, Mental retardation"
ENSG00000139549	DHH	"HHG-3, MGC35145"	"Desert hedgehog"	O43323	12	49089421-49094819	"Disease related genes, Predicted secreted proteins"		"Developmental protein, Hydrolase, Protease"	"Disease mutation"
ENSG00000128917	DLL4		"Delta like canonical Notch ligand 4"	Q9NR61	15	40929340-40939072	"Disease related genes, Predicted membrane proteins"	"Angiogenesis, Differentiation, Neurogenesis, Notch signaling pathway, Sensory transduction, Vision"	"Developmental protein"	"Disease mutation"
ENSG00000197959	DNM3	KIAA0820	"Dynamin 3"	Q9UQ16	1	171841498-172418466	"Enzymes, Plasma proteins, Predicted intracellular proteins"	Endocytosis	"Hydrolase, Motor protein"	
ENSG00000088387	DOCK9	"KIAA1058, ZIZ1"	"Dedicator of cytokinesis 9"	Q9BZ29	13	98793429-99086625	"Plasma proteins, Predicted intracellular proteins"		"Guanine-nucleotide releasing factor"	
ENSG00000135636	DYSF	"FER1L1, LGMD2B"	Dysferlin	O75923	2	71453722-71686768	"Disease related genes, Potential drug targets, Predicted membrane proteins, Transporters"			"Disease mutation, Limb-girdle muscular dystrophy"
ENSG00000108001	EBF3	"COE3, DKFZp667B0210"	"Early B cell factor 3"	Q9H4W6	10	129835283-129963841	"Disease related genes, Predicted intracellular proteins, Transcription factors"	"Transcription, Transcription regulation"	"Activator, Developmental protein, DNA-binding"	"Disease mutation, Mental retardation"
ENSG00000249751	ECSCR	"ARIA, ECSM2"	"Endothelial cell surface expressed chemotaxis and apoptosis regulator"	Q19T08	5	139448556-139462743	"Predicted membrane proteins"	"Angiogenesis, Apoptosis, Chemotaxis, Differentiation"	"Developmental protein"	
ENSG00000136160	EDNRB	"ETB, HSCR, HSCR2"	"Endothelin receptor type B"	P24530	13	77895481-77975529	"Disease related genes, FDA approved drug targets, G-protein coupled receptors, Predicted membrane proteins"		"G-protein coupled receptor, Receptor, Transducer"	"Albinism, Deafness, Disease mutation, FDA approved drug targets, Hirschsprung disease, Waardenburg syndrome"
ENSG00000114654	EFCC1	"C3orf73, CCDC48, FLJ12057"	"EF-hand and coiled-coil domain containing 1"	Q9HA90	3	129001629-129040742	"Predicted intracellular proteins"			
ENSG00000172889	EGFL7	ZNEU1	"EGF like domain multiple 7"	Q9UHF1	9	136658856-136672678	"Predicted secreted proteins"	"Angiogenesis, Cell adhesion, Differentiation"	"Developmental protein"	
ENSG00000111145	ELK3	"ERP, NET, SAP2"	"ELK3, ETS transcription factor"	P41970	12	96194382-96269835	"Cancer-related genes, Plasma proteins, Predicted intracellular proteins, Transcription factors"	"Transcription, Transcription regulation"	"Activator, DNA-binding, Repressor"	"Cancer-related genes"
ENSG00000155849	ELMO1	"CED-12, CED12, ELMO-1, KIAA0281"	"Engulfment and cell motility 1"	Q92556	7	36854361-37449249	"Predicted intracellular proteins"	"Apoptosis, Phagocytosis"		
ENSG00000164035	EMCN	MUC14	Endomucin	Q9ULC0	4	100395341-100880126	"Predicted intracellular proteins, Predicted membrane proteins"			
ENSG00000106991	ENG	"CD105, END, HHT1, ORW, ORW1"	Endoglin	P17813	9	127815012-127854756	"Cancer-related genes, Candidate cardiovascular disease genes, CD markers, Disease related genes, Plasma proteins, Predicted membrane proteins"	"Angiogenesis, Cell adhesion"		"Cancer-related genes, Disease mutation"
ENSG00000138185	ENTPD1	"ATPDase, CD39, NTPDase-1, SPG64"	"Ectonucleoside triphosphate diphosphohydrolase 1"	P49961	10	95711779-95869695	"CD markers, Disease related genes, Enzymes, Potential drug targets, Predicted membrane proteins"		Hydrolase	"Disease mutation, Hereditary spastic paraplegia, Neurodegeneration"
ENSG00000116016	EPAS1	"bHLHe73, HIF2A, HLF, MOP2, PASD2"	"Endothelial PAS domain protein 1"	Q99814	2	46293667-46386703	"Cancer-related genes, Disease related genes, Plasma proteins, Predicted intracellular proteins, Transcription factors"	"Angiogenesis, Differentiation, Transcription, Transcription regulation"	"Activator, Developmental protein, DNA-binding"	"Cancer-related genes, Congenital erythrocytosis, Disease mutation"
ENSG00000196411	EPHB4	"HTK, Tyro11"	"EPH receptor B4"	P54760	7	100802565-100827521	"Cancer-related genes, Disease related genes, Enzymes, Plasma proteins, Potential drug targets, Predicted intracellular proteins, Predicted membrane proteins"	Angiogenesis	"Developmental protein, Kinase, Receptor, Transferase, Tyrosine-protein kinase"	"Cancer-related genes, Disease mutation"
ENSG00000172031	EPHX4	"ABHD7, EPHXRP, FLJ90341"	"Epoxide hydrolase 4"	Q8IUS5	1	92029982-92063536	"Predicted intracellular proteins"		Hydrolase	
ENSG00000157554	ERG	"erg-3, p55"	"ERG, ETS transcription factor"	P11308	21	38380027-38661780	"Cancer-related genes, Disease related genes, Predicted intracellular proteins, Transcription factors"	"Transcription, Transcription regulation"	DNA-binding	"Cancer-related genes, Proto-oncogene"
ENSG00000149564	ESAM	W117m	"Endothelial cell adhesion molecule"	Q96AP7	11	124752583-124762290	"Plasma proteins, Predicted membrane proteins"	"Cell adhesion"		
ENSG00000164283	ESM1		"Endothelial cell specific molecule 1"	Q9NQ30	5	54977864-55022671	"Predicted secreted proteins"	Angiogenesis		
ENSG00000134954	ETS1	"ETS-1, EWSR2, FLJ10768"	"ETS proto-oncogene 1, transcription factor"	P14921	11	128458761-128587558	"Plasma proteins, Predicted intracellular proteins, RAS pathway related proteins, Transcription factors"	"Immunity, Transcription, Transcription regulation"	DNA-binding	Proto-oncogene
ENSG00000179044	EXOC3L1	"EXOC3L, FLJ35539, FLJ35587"	"Exocyst complex component 3 like 1"	Q86VI1	16	67184366-67190204	"Predicted intracellular proteins"	Exocytosis		
ENSG00000127533	F2RL3	PAR4	"F2R like thrombin or trypsin receptor 3"	Q96RI0	19	16888860-16892606	"G-protein coupled receptors, Plasma proteins, Predicted intracellular proteins, Predicted membrane proteins"	"Blood coagulation, Hemostasis"	"G-protein coupled receptor, Receptor, Transducer"	
ENSG00000168309	FAM107A	"DRR1, TU3A"	"Family with sequence similarity 107 member A"	O95990	3	58564117-58627610	"Predicted intracellular proteins"	"Cell cycle, Growth regulation, Stress response"	Actin-binding	
ENSG00000197245	FAM110D	"FLJ14050, GRRP1"	"Family with sequence similarity 110 member D"	Q8TAY7	1	26159020-26163962	"Predicted intracellular proteins"			
ENSG00000124019	FAM124B	FLJ22746	"Family with sequence similarity 124 member B"	Q9H5Z6	2	224378698-224402085	"Predicted intracellular proteins"			
ENSG00000164125	FAM198B	"C4orf18, DKFZp434L142, ENED, FLJ38155"	"Family with sequence similarity 198 member B"	Q6UWH4	4	158124474-158173318	"Predicted intracellular proteins, Predicted membrane proteins"			
ENSG00000185112	FAM43A	FLJ90022	"Family with sequence similarity 43 member A"	Q8N2R8	3	194686544-194689037	"Predicted intracellular proteins"			
ENSG00000165716	FAM69B	"C9orf136, MGC20262"	"Family with sequence similarity 69 member B"	Q5VUD6	9	136712570-136724050	"Predicted intracellular proteins, Predicted membrane proteins"			
ENSG00000196159	FAT4	"CDHF14, CDHR11, FAT-J"	"FAT atypical cadherin 4"	Q6V0I7	4	125316399-125492932	"Cancer-related genes, Disease related genes, Predicted membrane proteins"	"Cell adhesion"		"Cancer-related genes, Deafness, Disease mutation, Mental retardation"
ENSG00000183580	FBXL7	"FBL6, FBL7, KIAA0840"	"F-box and leucine rich repeat protein 7"	Q9UJT9	5	15500196-15939795	"Plasma proteins, Predicted intracellular proteins"	"Cell cycle, Cell division, Mitosis, Ubl conjugation pathway"		
ENSG00000154783	FGD5	"FLJ00274, FLJ39957, ZFYVE23"	"FYVE, RhoGEF and PH domain containing 5"	Q6ZNL6	3	14810853-14934565	"Predicted intracellular proteins"		"Guanine-nucleotide releasing factor"	
ENSG00000151702	FLI1	"EWSR2, SIC-1"	"Fli-1 proto-oncogene, ETS transcription factor"	Q01543	11	128686535-128813267	"Cancer-related genes, Disease related genes, Predicted intracellular proteins, Transcription factors"	"Transcription, Transcription regulation"	"Activator, DNA-binding"	"Cancer-related genes, Disease mutation, Proto-oncogene"
ENSG00000054598	FOXC1	"ARA, FKHL7, FREAC3, IGDA, IHG1, IRID1"	"Forkhead box C1"	Q12948	6	1609972-1613897	"Disease related genes, Plasma proteins, Predicted intracellular proteins, Transcription factors"	"Angiogenesis, Transcription, Transcription regulation"	"Activator, Developmental protein, DNA-binding, Repressor"	"Deafness, Disease mutation, Peters anomaly"
ENSG00000103241	FOXF1	"FKHL5, FREAC1"	"Forkhead box F1"	Q12946	16	86510527-86515418	"Disease related genes, Predicted intracellular proteins, Transcription factors"	"Transcription, Transcription regulation"	"Activator, DNA-binding"	"Disease mutation"
ENSG00000174951	FUT1	"H, HSC"	"Fucosyltransferase 1 (H blood group)"	P19526	19	48748011-48755390	"Blood group antigen proteins, Enzymes, Predicted membrane proteins"		"Blood group antigen, Glycosyltransferase, Transferase"	
ENSG00000174804	FZD4	"CD344, EVR1"	"Frizzled class receptor 4"	Q9ULV1	11	86945679-86955391	"CD markers, Disease related genes, G-protein coupled receptors, Potential drug targets, Predicted membrane proteins"	"Wnt signaling pathway"	"Developmental protein, G-protein coupled receptor, Receptor, Transducer"	"Disease mutation"
ENSG00000131386	GALNT15	"GALNT7, GALNTL2, pp-GalNAc-T15"	"Polypeptide N-acetylgalactosaminyltransferase 15"	Q8N3T1	3	16174649-16231992	"Enzymes, Predicted intracellular proteins"		"Glycosyltransferase, Transferase"	
ENSG00000110328	GALNT18	"GalNAc-T18, GALNT15, GALNTL4, MGC71806"	"Polypeptide N-acetylgalactosaminyltransferase 18"	Q6P9A2	11	11270876-11622005	"Enzymes, Predicted membrane proteins"		"Glycosyltransferase, Transferase"	
ENSG00000162654	GBP4	Mpa2	"Guanylate binding protein 4"	Q96PP9	1	89181148-89198932	"Plasma proteins, Predicted intracellular proteins"		Hydrolase	
ENSG00000213512	GBP7	"FLJ38822, GBP4L"	"Guanylate binding protein 7"	Q8N8V2	1	89131751-89176040	"Predicted intracellular proteins"		Antimicrobial	
ENSG00000213203	GIMAP1	"HIMAP1, IAN2, IMAP1, IMAP38"	"GTPase, IMAP family member 1"	Q8WWP7	7	150716557-150724284	"Predicted membrane proteins"			
ENSG00000133574	GIMAP4	"FLJ11110, HIMAP4, IAN1, IMAP4"	"GTPase, IMAP family member 4"	Q9NUV9	7	150567277-150573955	"Predicted intracellular proteins"			
ENSG00000196329	GIMAP5	"HIMAP3, IAN4L1, IAN5"	"GTPase, IMAP family member 5"	Q96F15	7	150722253-150750033	"Predicted membrane proteins"			
ENSG00000133561	GIMAP6	"FLJ22690, IAN6"	"GTPase, IMAP family member 6"	Q6P9H5	7	150625375-150632648	"Predicted intracellular proteins"			
ENSG00000179144	GIMAP7	"IAN7, MGC27027"	"GTPase, IMAP family member 7"	Q8NHV1	7	150514830-150521073	"Predicted intracellular proteins"			
ENSG00000171115	GIMAP8	"DKFZp667I133, hIAN6, IAN9"	"GTPase, IMAP family member 8"	Q8ND71	7	150450630-150479392	"Predicted intracellular proteins"			
ENSG00000127920	GNG11	GNGT11	"G protein subunit gamma 11"	P61952	7	93921699-93928610	"Predicted intracellular proteins, RAS pathway related proteins"		Transducer	
ENSG00000277494	GPIHBP1	"GPI-HBP1, LOC338328"	"Glycosylphosphatidylinositol anchored high density lipoprotein binding protein 1"	Q8IV16	8	143213193-143217170	"Disease related genes, Predicted intracellular proteins"	Transport		"Disease mutation"
ENSG00000164849	GPR146	PGR8	"G protein-coupled receptor 146"	Q96CH1	7	1044576-1059261	"G-protein coupled receptors, Predicted intracellular proteins, Predicted membrane proteins"		"G-protein coupled receptor, Receptor, Transducer"	
ENSG00000177464	GPR4		"G protein-coupled receptor 4"	P46093	19	45589764-45602208	"G-protein coupled receptors, Predicted membrane proteins"		"G-protein coupled receptor, Receptor, Transducer"	
ENSG00000154016	GRAP		"GRB2-related adaptor protein"	Q13588	17	19020673-19047637	"Plasma proteins, Predicted intracellular proteins"			"Deafness, Disease mutation, Non-syndromic deafness"
ENSG00000161835	GRASP	Tamalin	"General receptor for phosphoinositides 1 associated scaffold protein"	Q7Z6J2	12	52006940-52015889	"Predicted intracellular proteins"			
ENSG00000164683	HEY1	"bHLHb31, CHF-2, CHF2, HERP2, HESR-1, HESR1, HRT-1"	"Hes related family bHLH transcription factor with YRPW motif 1"	Q9Y5J3	8	79764010-79767863	"Cancer-related genes, Predicted intracellular proteins, Transcription factors"	"Notch signaling pathway, Transcription, Transcription regulation"	"Developmental protein, DNA-binding, Repressor"	"Cancer-related genes"
ENSG00000152804	HHEX	"HEX, HOX11L-PEN, PRHX"	"Hematopoietically expressed homeobox"	Q03014	10	92689951-92695646	"Predicted intracellular proteins, Transcription factors"	"Differentiation, Transcription, Transcription regulation, Wnt signaling pathway"	"Developmental protein, DNA-binding, Repressor"	
ENSG00000177374	HIC1	"ZBTB29, ZNF901"	"HIC ZBTB transcriptional repressor 1"	Q14526	17	2054154-2063241	"Predicted intracellular proteins, Transcription factors"	"Transcription, Transcription regulation, Wnt signaling pathway"	"Developmental protein, DNA-binding, Repressor"	"Tumor suppressor"
ENSG00000204592	HLA-E		"Major histocompatibility complex, class I, E"		6	30489467-30494205	"Predicted membrane proteins"			
ENSG00000143341	HMCN1	"ARMD1, FBLN6, FIBL-6, FIBL6"	"Hemicentin 1"	Q96RW7	1	185734551-186190949	"Disease related genes, Predicted intracellular proteins, Predicted secreted proteins"	"Cell cycle, Cell division, Sensory transduction, Vision"		"Age-related macular degeneration, Disease mutation"
ENSG00000132622	HSPA12B	"C20orf60, dJ1009E24.2"	"Heat shock protein family A (Hsp70) member 12B"	Q96MM6	20	3732667-3753111	"Plasma proteins, Predicted intracellular proteins"			
ENSG00000068001	HYAL2	"LuCa-2, LUCA2"	"Hyaluronoglucosaminidase 2"	Q12891	3	50317790-50322906	"Enzymes, Predicted intracellular proteins, Predicted membrane proteins"		"Glycosidase, Hydrolase, Receptor"	
ENSG00000108622	ICAM2	CD102	"Intercellular adhesion molecule 2"	P13598	17	64002594-64020634	"CD markers, Plasma proteins, Predicted intracellular proteins, Predicted membrane proteins"	"Cell adhesion"		
ENSG00000165949	IFI27	"FAM14D, ISG12, P27"	"Interferon alpha inducible protein 27"		14	94104836-94116698	"Predicted intracellular proteins, Predicted membrane proteins"			
ENSG00000137965	IFI44	"MTAP44, p44, TLDC5"	"Interferon induced protein 44"	Q8TCB0	1	78649796-78664078	"Predicted intracellular proteins"			
ENSG00000137959	IFI44L	"C1orf29, GS3686"	"Interferon induced protein 44 like"	Q53G44	1	78619922-78646145	"Predicted intracellular proteins"	"Antiviral defense"		
ENSG00000137033	IL33	"C9orf26, DKFZp586H0523, DVS27, IL1F11, NF-HEV"	"Interleukin 33"	O95760	9	6215786-6257983	"Predicted intracellular proteins, Predicted secreted proteins"	Transcription	Cytokine	
ENSG00000185291	IL3RA	CD123	"Interleukin 3 receptor subunit alpha"	P26951	X	1336616-1382689	"CD markers, FDA approved drug targets, Predicted intracellular proteins, Predicted membrane proteins"		Receptor	"FDA approved drug targets"
ENSG00000213949	ITGA1	"CD49a, VLA1"	"Integrin subunit alpha 1"	P56199	5	52787896-52959210	"Cancer-related genes, CD markers, Plasma proteins, Predicted membrane proteins, Transporters"	"Cell adhesion"	"Integrin, Receptor"	"Cancer-related genes"
ENSG00000143127	ITGA10		"Integrin subunit alpha 10"	O75578	1	145891208-145910189	"Plasma proteins, Predicted membrane proteins"	"Cell adhesion"	"Integrin, Receptor"	
ENSG00000078596	ITM2A	"BRICD2A, E25A"	"Integral membrane protein 2A"	O43736	X	79360384-79367667	"Predicted intracellular proteins, Predicted membrane proteins"			
ENSG00000143772	ITPKB	"IP3-3KB, IP3KB"	"Inositol-trisphosphate 3-kinase B"	P27987	1	226631690-226739323	"Cancer-related genes, Enzymes, Predicted intracellular proteins"		"Calmodulin-binding, Kinase, Transferase"	"Cancer-related genes"
